{
  "$schema": "https://json-schema.org/draft/2020-12/schema",
  "$id": "https://ponta0321.github.io/game-achievement-common-spec/v1.0.0/achievement.schema.json",
  "title": "Achievement",
  "description": "Game Achievement Common Spec v1.0.0 — Achievement definition",
  "$defs": {
    "bcp47": {
      "type": "string",
      "pattern": "^[a-z]{2,3}(-[A-Z][a-z]{3})?(-([A-Z]{2}|[0-9]{3}))?(-[A-Za-z0-9]{5,8})?$",
      "description": "BCP 47 language tag (simplified). Supports language, optional script (4 chars), optional region (2 alpha or 3 digit), optional single variant (5-8 chars). Examples: ja, en, en-US, zh-Hant, zh-Hant-TW, pt-BR, es-419, de-CH-1996. Grandfathered/private-use tags are not supported."
    },
    "i18nMapTitle": {
      "type": "object",
      "description": "Translation map keyed by BCP 47 language tags. Values are titles (2-80 chars).",
      "patternProperties": {
        "^[a-z]{2,3}(-[A-Z][a-z]{3})?(-([A-Z]{2}|[0-9]{3}))?(-[A-Za-z0-9]{5,8})?$": {
          "type": "string",
          "minLength": 2,
          "maxLength": 80
        }
      },
      "additionalProperties": false
    },
    "i18nMapText": {
      "type": "object",
      "description": "Translation map keyed by BCP 47 language tags. Values are short text (1+ chars, no upper bound here; field-specific maxLength applies).",
      "patternProperties": {
        "^[a-z]{2,3}(-[A-Z][a-z]{3})?(-([A-Z]{2}|[0-9]{3}))?(-[A-Za-z0-9]{5,8})?$": {
          "type": "string",
          "minLength": 1
        }
      },
      "additionalProperties": false
    },
    "i18nMapDescription": {
      "type": "object",
      "description": "Translation map keyed by BCP 47 language tags. Values are descriptions (up to 600 chars).",
      "patternProperties": {
        "^[a-z]{2,3}(-[A-Z][a-z]{3})?(-([A-Z]{2}|[0-9]{3}))?(-[A-Za-z0-9]{5,8})?$": {
          "type": "string",
          "maxLength": 600
        }
      },
      "additionalProperties": false
    }
  },
  "type": "object",
  "required": [
    "schema_version",
    "uid",
    "primary_lang",
    "item_refs",
    "title",
    "created_at",
    "license"
  ],
  "properties": {
    "schema_version": {
      "type": "string",
      "const": "1.0.0"
    },
    "uid": {
      "type": "string",
      "pattern": "^[a-z0-9.-]+:ach:[A-Za-z0-9_:-]+$",
      "description": "Globally unique ID. Format: <site_namespace>:ach:<local_id>. local_id may contain ':' for hierarchical IDs (e.g. 'default:cleared:17602')."
    },
    "source_site": {
      "type": ["string", "null"],
      "format": "uri",
      "description": "Origin site URL (optional). Redundant with the namespace prefix of `uid`; included only when a richer URL than the bare domain is needed (e.g. https path with locale)."
    },
    "primary_lang": {
      "$ref": "#/$defs/bcp47",
      "description": "BCP 47 language tag identifying the language of `title`, `description`, `item_refs.title`, `item_refs.maker`. The `*_i18n` maps provide translations; entries SHOULD NOT duplicate the primary language."
    },
    "item_refs": {
      "type": "object",
      "required": ["title", "platform"],
      "properties": {
        "local_id": {
          "type": ["integer", "null"],
          "description": "Origin site internal item ID (optional)"
        },
        "title": {
          "type": "string",
          "minLength": 1,
          "description": "Game title in the parent Achievement's `primary_lang`. Translations go in `title_i18n`."
        },
        "title_i18n": {
          "$ref": "#/$defs/i18nMapText",
          "description": "Optional translations of the game title (e.g. 'ファイナルファンタジーVII' vs 'Final Fantasy VII')."
        },
        "platform": {
          "type": "string",
          "pattern": "^[A-Z0-9_]{2,16}$",
          "description": "Platform identifier (uppercase ASCII + digits + underscore, 2-16 chars). Recommended values: PS, PS2, PS3, PS4, PS5, PSP, PSV, NSW, WIIU, WII, GC, N64, SNES, SFC, NES, FC, GB, GBA, GBC, NDS, 3DS, XBOX, X360, XBONE, XBSX, PC, ARC, MD, SAT, DC, PCE, NEOGEO."
        },
        "release_date": {
          "type": ["string", "null"],
          "format": "date"
        },
        "maker": {
          "type": ["string", "null"],
          "description": "Maker / publisher in the parent Achievement's `primary_lang`. Translations go in `maker_i18n`."
        },
        "maker_i18n": {
          "$ref": "#/$defs/i18nMapText",
          "description": "Optional translations of the maker name (e.g. 'スクウェア' vs 'Square')."
        },
        "external_ids": {
          "type": "object",
          "description": "Recommended keys: igdb_id, mobygames_id, wikidata_id, ra_game_id, steam_appid, xbox_title_id, psn_np_communication_id. Additional keys are allowed for future / vendor-specific IDs.",
          "properties": {
            "igdb_id":      { "type": ["integer", "null"] },
            "mobygames_id": { "type": ["integer", "null"] },
            "wikidata_id":  { "type": ["string", "null"], "pattern": "^Q[0-9]+$" },
            "ra_game_id":   { "type": ["integer", "null"], "description": "RetroAchievements game ID" }
          },
          "additionalProperties": true
        }
      },
      "additionalProperties": false
    },
    "title": {
      "type": "string",
      "minLength": 2,
      "maxLength": 80,
      "description": "Achievement title in `primary_lang`. Translations go in `title_i18n`."
    },
    "title_i18n": {
      "$ref": "#/$defs/i18nMapTitle",
      "description": "Optional translations of `title`. Keys SHOULD NOT include `primary_lang` (DRY)."
    },
    "description": {
      "type": ["string", "null"],
      "maxLength": 600,
      "description": "Achievement description in `primary_lang`. Translations go in `description_i18n`."
    },
    "description_i18n": {
      "$ref": "#/$defs/i18nMapDescription",
      "description": "Optional translations of `description`. Keys SHOULD NOT include `primary_lang` (DRY)."
    },
    "category": {
      "type": ["string", "null"],
      "enum": ["clear", "speedrun", "collection", "challenge", "discovery", "social", "other", null]
    },
    "difficulty": {
      "type": ["integer", "null"],
      "minimum": 1,
      "maximum": 5
    },
    "conditions": {
      "type": "array",
      "description": "Machine-readable conditions (optional). `type` is a free-form lowercase_snake_case identifier. Recommended values: no_damage, no_death, no_item_use, no_save, time_under, score_over, collect_all, level_under, boss_defeat, chapter_complete, custom.",
      "items": {
        "type": "object",
        "required": ["type"],
        "properties": {
          "type": {
            "type": "string",
            "pattern": "^[a-z][a-z0-9_]{1,31}$"
          },
          "param": { "type": ["string", "null"] },
          "value": { "type": ["number", "null"] }
        },
        "additionalProperties": false
      },
      "default": []
    },
    "tags": {
      "type": "array",
      "items": { "type": "string", "maxLength": 30 },
      "maxItems": 10,
      "default": []
    },
    "thumbnail": {
      "type": ["object", "null"],
      "description": "Reference thumbnail (16x16 square, recommended). data_uri only. Identity is verified by sha256 of binary content. For higher-resolution variants use `thumbnails_extra`.",
      "required": ["data_uri"],
      "properties": {
        "data_uri": {
          "type": "string",
          "pattern": "^data:image/(png|webp|gif);base64,[A-Za-z0-9+/=]+$",
          "maxLength": 2000,
          "description": "16x16 pixel art encoded as base64 data URI. ~1.4KB binary max."
        }
      },
      "additionalProperties": false
    },
    "thumbnails_extra": {
      "type": "array",
      "description": "Optional additional thumbnail variants at larger sizes (64/128/256/512). Useful when importing from Steam/Xbox/PSN/RetroAchievements where source icons are high-resolution. sha256 identity should still be computed primarily against `thumbnail` (16x16 reference). See README §7.3.",
      "maxItems": 5,
      "items": {
        "type": "object",
        "required": ["size", "data_uri"],
        "properties": {
          "size": {
            "type": "integer",
            "enum": [32, 64, 128, 256, 512],
            "description": "Edge length in pixels. Square only."
          },
          "data_uri": {
            "type": "string",
            "pattern": "^data:image/(png|webp|gif);base64,[A-Za-z0-9+/=]+$",
            "maxLength": 80000,
            "description": "Base64 data URI. ~55KB binary max per entry. Total payload should stay under ~200KB across all extras."
          }
        },
        "additionalProperties": false
      },
      "default": []
    },
    "created_by": {
      "type": ["string", "null"],
      "description": "Handle name (optional). CC0 does not require attribution; use `attribution` field instead when credit is desired."
    },
    "created_at": {
      "type": "string",
      "format": "date-time"
    },
    "updated_at": {
      "type": ["string", "null"],
      "format": "date-time"
    },
    "license": {
      "type": "string",
      "description": "SPDX license identifier. Default is CC0-1.0 to maximize portability.",
      "default": "CC0-1.0"
    },
    "attribution": {
      "type": ["string", "null"]
    }
  },
  "additionalProperties": false
}
